{
  "schema_version": "gaza_edition_correction_review_v1",
  "story_id": "gaza-story-2026-10-14-001",
  "owning_edition_date": "2026-10-14",
  "reason": "scope_error",
  "decision": "confirmed_public_scope_contamination",
  "resulting_review_state": "substantively_reviewed",
  "lineage_sha256": "7b566a716ecb64f4ba9c6128382b69522b78e02d10de7c56082d67c14c596113",
  "review_packet_sha256": "374c8cc79051be3870f3ec6d8d38f052ac5cab519d59686d10512e0e42c66807",
  "reviewer": "Independent read-only source reviewer",
  "reviewed_at": "2026-10-15T00:01:56.4539911Z",
  "decision_reason": "The saved publisher source identifies the reported event as the opening of Colombia's embassy in Jerusalem. Gaza appears as surrounding geopolitical context; the saved evidence does not establish an in-Gaza ground development. This confirms a scope contamination decision for Gaza core selection, not a claim that the source is false.",
  "evidence_references": [
    {
      "role": "principal",
      "url": "https://www.aljazeera.com/news/2026/10/14/colombia-inaugurates-embassy-to-israel-in-jerusalem?traffic_source=rss",
      "supporting_passage": "The saved publisher source identifies the reported event as Colombia opening its embassy to Israel in Jerusalem.",
      "evidence_type": "source_scope"
    }
  ],
  "assessment": {
    "materially_concerns_gaza": false
  },
  "archive_authorized": false,
  "edition_authorized": false,
  "queue_authorized": false,
  "source_record_authorized": false,
  "cluster_authorized": false,
  "audio_authorized": false,
  "publication_authorized": false,
  "approval_authorized": false
}
